{
  "id": "end-card",
  "version": "1.0.0",
  "purpose": "Closing message, with an optional call to action and credits.",
  "slots": {
    "default": {
      "required": true,
      "accepts": ["paragraph", "heading"]
    },
    "cta": {
      "required": false,
      "accepts": ["paragraph"]
    },
    "credits": {
      "required": false,
      "accepts": ["list"]
    }
  },
  "props": {},
  "placements": [],
  "compatibleAnimations": ["fade-in", "reveal", "slide-up"],
  "compatibleTransitions": [],
  "duration": {
    "minMs": 2000,
    "maxMs": 30000
  },
  "accessibility": "The message, the optional call to action and the credits are the only content. Colour and size come from the theme (task 019): the call to action uses the accent token and the credits the muted text token. Credits are one line per list item and are set smaller, never clipped, when the list is long."
}
